{
  "schema_version": "1.0.0",
  "calculation_version": "basic-tca-v1",
  "report_id": "7ff0758c-f46d-5b85-9025-b01dbec862b0",
  "scope": "DAILY_PAPER",
  "correlation_id": "paper-session-001",
  "period": {
    "date_utc": "2026-09-12",
    "start_ts_ns": 1789164000000000000,
    "end_ts_ns": 1789250399999999999
  },
  "summary": {
    "opportunities_detected": 1,
    "opportunities_executed": 1,
    "missed_opportunities": 0,
    "orders": 2,
    "fills": 2,
    "rejects": 0,
    "cancels": 0,
    "partials": 0,
    "timeouts": 0,
    "unwind_orders": 0,
    "unwind_fills": 0,
    "open_residual_base": "0",
    "filled_quantity": "0.020",
    "benchmark_notional": "1200.60000",
    "filled_notional": "1200.60000",
    "slippage_quote": "0.00000",
    "weighted_slippage_bps": "0",
    "fees": "0.48024",
    "unwind_cost": "0",
    "net_pnl": "0.11976"
  },
  "groups": [
    {
      "venue": "BINANCE",
      "instrument_id": "BTC-USDT-SPOT",
      "order_type": "LIMIT",
      "orders": 1,
      "fills": 1,
      "rejects": 0,
      "cancels": 0,
      "partials": 0,
      "timeouts": 0,
      "unwind_orders": 0,
      "unwind_fills": 0,
      "missed_opportunities": 0,
      "filled_quantity": "0.010",
      "benchmark_notional": "600.00000",
      "filled_notional": "600.00000",
      "slippage_quote": "0.00000",
      "weighted_slippage_bps": "0",
      "fees": "0.24000"
    },
    {
      "venue": "BYBIT",
      "instrument_id": "BTC-USDT-SPOT",
      "order_type": "LIMIT",
      "orders": 1,
      "fills": 1,
      "rejects": 0,
      "cancels": 0,
      "partials": 0,
      "timeouts": 0,
      "unwind_orders": 0,
      "unwind_fills": 0,
      "missed_opportunities": 0,
      "filled_quantity": "0.010",
      "benchmark_notional": "600.60000",
      "filled_notional": "600.60000",
      "slippage_quote": "0.00000",
      "weighted_slippage_bps": "0",
      "fees": "0.24024"
    }
  ],
  "opportunities": [
    {
      "opportunity_id": "opportunity-example",
      "parent_id": "parent-example",
      "observed_ts_ns": 1789207200000000000,
      "expected_net_edge_bps": "2.000",
      "executed": true,
      "missed": false,
      "missed_reason": "",
      "terminal_outcome": "FILLED",
      "residual_base": "0",
      "source_event_ids": ["binance-event-1", "bybit-event-1"],
      "raw_refs": ["raw://paper-session-001/binance/1", "raw://paper-session-001/bybit/1"]
    }
  ],
  "lineage": {
    "canonical_source_path": "data/canonical/paper-session-001/events.jsonl",
    "canonical_source_sha256": "d5f14455fd14f8f7968114b8fca7cedf78984518bb05200f60fd5e473392e893",
    "source_event_ids": ["binance-event-1", "bybit-event-1"],
    "raw_refs": ["raw://paper-session-001/binance/1", "raw://paper-session-001/bybit/1"],
    "source_event_raw_refs": {
      "binance-event-1": "raw://paper-session-001/binance/1",
      "bybit-event-1": "raw://paper-session-001/bybit/1"
    },
    "raw_reference_coverage": 1.0
  },
  "calculation": {
    "benchmark": "child decision/limit price at dispatch",
    "buy_slippage_quote": "(average_fill_price - benchmark_price) * filled_quantity",
    "sell_slippage_quote": "(benchmark_price - average_fill_price) * filled_quantity",
    "weighted_slippage_bps": "sum(slippage_quote) / sum(filled_quantity * benchmark_price) * 10000",
    "sign": "positive is adverse; negative is price improvement",
    "missed_opportunity": "not all primary children filled or residual outside approved bound"
  }
}
